{
  "schemaVersion": "1.0.0",
  "asOf": "2026-09-03",
  "policy": {
    "defaultDecision": "hold",
    "allGatesRequired": true,
    "repeatRunsDoNotIncreaseCaseCount": true,
    "shadowRunsChargeCredits": false,
    "manualOverrideCanBypassFailedGate": false
  },
  "products": [
    { "productId": "poe2-build-decision-review", "minimumShadowCases": 20, "minimumSupportedCases": 12, "minimumSupportedQaPassRate": 0.9, "minimumNoChargeCases": 3, "minimumNoChargeAccuracy": 1, "criticalDriftWindowCases": 10, "maximumCriticalDrift": 0, "maximumEvidenceAgeHours": 72, "minimumInterReviewerCases": 0, "minimumInterReviewerAgreementRate": 0, "idempotencyRequired": true, "inAccountDeliveryRequired": true },
    { "productId": "palworld-base-progression-review", "minimumShadowCases": 15, "minimumSupportedCases": 10, "minimumSupportedQaPassRate": 0.9, "minimumNoChargeCases": 3, "minimumNoChargeAccuracy": 1, "criticalDriftWindowCases": 10, "maximumCriticalDrift": 0, "maximumEvidenceAgeHours": 72, "minimumInterReviewerCases": 0, "minimumInterReviewerAgreementRate": 0, "idempotencyRequired": true, "inAccountDeliveryRequired": true },
    { "productId": "project-zomboid-save-plan-review", "minimumShadowCases": 15, "minimumSupportedCases": 10, "minimumSupportedQaPassRate": 0.9, "minimumNoChargeCases": 3, "minimumNoChargeAccuracy": 1, "criticalDriftWindowCases": 10, "maximumCriticalDrift": 0, "maximumEvidenceAgeHours": 72, "minimumInterReviewerCases": 0, "minimumInterReviewerAgreementRate": 0, "idempotencyRequired": true, "inAccountDeliveryRequired": true },
    { "productId": "escape-from-tarkov-loadout-route-review", "minimumShadowCases": 20, "minimumSupportedCases": 12, "minimumSupportedQaPassRate": 0.9, "minimumNoChargeCases": 3, "minimumNoChargeAccuracy": 1, "criticalDriftWindowCases": 10, "maximumCriticalDrift": 0, "maximumEvidenceAgeHours": 72, "minimumInterReviewerCases": 0, "minimumInterReviewerAgreementRate": 0, "idempotencyRequired": true, "inAccountDeliveryRequired": true },
    { "productId": "ark-survival-ascended-roster-plan-review", "minimumShadowCases": 20, "minimumSupportedCases": 12, "minimumSupportedQaPassRate": 0.9, "minimumNoChargeCases": 3, "minimumNoChargeAccuracy": 1, "criticalDriftWindowCases": 10, "maximumCriticalDrift": 0, "maximumEvidenceAgeHours": 72, "minimumInterReviewerCases": 0, "minimumInterReviewerAgreementRate": 0, "idempotencyRequired": true, "inAccountDeliveryRequired": true },
    { "productId": "warframe-build-progression-review", "minimumShadowCases": 20, "minimumSupportedCases": 12, "minimumSupportedQaPassRate": 0.9, "minimumNoChargeCases": 3, "minimumNoChargeAccuracy": 1, "criticalDriftWindowCases": 10, "maximumCriticalDrift": 0, "maximumEvidenceAgeHours": 72, "minimumInterReviewerCases": 0, "minimumInterReviewerAgreementRate": 0, "idempotencyRequired": true, "inAccountDeliveryRequired": true },
    { "productId": "once-human-scenario-build-review", "minimumShadowCases": 15, "minimumSupportedCases": 10, "minimumSupportedQaPassRate": 0.9, "minimumNoChargeCases": 3, "minimumNoChargeAccuracy": 1, "criticalDriftWindowCases": 10, "maximumCriticalDrift": 0, "maximumEvidenceAgeHours": 72, "minimumInterReviewerCases": 0, "minimumInterReviewerAgreementRate": 0, "idempotencyRequired": true, "inAccountDeliveryRequired": true },
    { "productId": "counter-strike-2-round-plan-review", "minimumShadowCases": 25, "minimumSupportedCases": 15, "minimumSupportedQaPassRate": 0.9, "minimumNoChargeCases": 3, "minimumNoChargeAccuracy": 1, "criticalDriftWindowCases": 10, "maximumCriticalDrift": 0, "maximumEvidenceAgeHours": 72, "minimumInterReviewerCases": 10, "minimumInterReviewerAgreementRate": 0.8, "idempotencyRequired": true, "inAccountDeliveryRequired": true },
    { "productId": "dota-2-match-decision-review", "minimumShadowCases": 25, "minimumSupportedCases": 15, "minimumSupportedQaPassRate": 0.9, "minimumNoChargeCases": 3, "minimumNoChargeAccuracy": 1, "criticalDriftWindowCases": 10, "maximumCriticalDrift": 0, "maximumEvidenceAgeHours": 72, "minimumInterReviewerCases": 10, "minimumInterReviewerAgreementRate": 0.8, "idempotencyRequired": true, "inAccountDeliveryRequired": true },
    { "productId": "pubg-battlegrounds-rotation-review", "minimumShadowCases": 20, "minimumSupportedCases": 12, "minimumSupportedQaPassRate": 0.9, "minimumNoChargeCases": 3, "minimumNoChargeAccuracy": 1, "criticalDriftWindowCases": 10, "maximumCriticalDrift": 0, "maximumEvidenceAgeHours": 72, "minimumInterReviewerCases": 10, "minimumInterReviewerAgreementRate": 0.8, "idempotencyRequired": true, "inAccountDeliveryRequired": true },
    { "productId": "rainbow-six-siege-operator-site-review", "minimumShadowCases": 20, "minimumSupportedCases": 12, "minimumSupportedQaPassRate": 0.9, "minimumNoChargeCases": 3, "minimumNoChargeAccuracy": 1, "criticalDriftWindowCases": 10, "maximumCriticalDrift": 0, "maximumEvidenceAgeHours": 72, "minimumInterReviewerCases": 0, "minimumInterReviewerAgreementRate": 0, "idempotencyRequired": true, "inAccountDeliveryRequired": true }
  ]
}
